{
  "case_schema_version": "1.0.0",
  "case_id": "CASE-D850D326D21B745D",
  "case_status": "analysis_in_progress",
  "created_at": "2026-08-05T16:30:00Z",
  "updated_at": "2026-08-05T16:45:00Z",
  "organization_context": {
    "organization_id": "ICMSOL",
    "organization_name": "Integrated Consulting and Management Solutions, LLC",
    "profile_version": "1.0.0",
    "service_catalog_version": "1.0.0",
    "rules_version": "1.0.0",
    "reviewer_roles_version": "1.0.0",
    "thresholds_version": "1.0.0",
    "fixed_safeguards_version": "1.0.0"
  },
  "opportunity": {
    "record_schema_version": "1.0.0",
    "opportunity_id": "OPP-E19200F7BD6C3161",
    "case_id": "CASE-D850D326D21B745D",
    "source": {
      "source_id": "SRC-P4-01-OPPORTUNITY",
      "source_type": "synthetic",
      "source_location": "data/implementation/p4_01/raw_opportunity.json",
      "retrieved_at": "2026-08-05T16:30:00Z",
      "snapshot_date": "2026-08-05",
      "sha256": "e152ac2dad41a7e34e41cf27742fb7c0e05aafd46e5d68d9a42f0ef00c00b7c2",
      "approved_for_use": true,
      "approval_basis": "Synthetic frozen opportunity approved for controlled Project 7 implementation testing.",
      "notes": "No real procurement, client-confidential, credential, or personal information is represented."
    },
    "source_portal": "Project 7 Synthetic Procurement Portal",
    "jurisdiction": "California",
    "agency": "Synthetic Department of Digital Services",
    "solicitation_id": "RFO-2026-001",
    "title": "Enterprise IT Strategy, Program Management, and Systems Integration Support",
    "normalized_title": "enterprise it strategy, program management, and systems integration support",
    "description": "Provide enterprise IT strategy, project and program management, systems integration, agile delivery support, organizational change management, and technical training.",
    "status": "open",
    "posted_at": "2026-08-01T00:00:00Z",
    "due_at": "2026-09-16T00:00:00Z",
    "fiscal_year": "2026",
    "fiscal_quarter": "Q3",
    "place_of_performance": "California",
    "procurement_method": "Request for Offer",
    "contract_vehicle": "Synthetic Statewide Contract",
    "estimated_value": {
      "amount": 2500000,
      "currency": "USD"
    },
    "ingested_at": "2026-08-05T16:30:00Z",
    "normalization_version": "1.0.0",
    "record_key": "d850d326d21b745d1bc1",
    "original_values": {
      "source_portal": "Project 7 Synthetic Procurement Portal",
      "jurisdiction": "California",
      "agency": "Synthetic Department of Digital Services",
      "solicitation_id": "RFO-2026-001",
      "title": "  Enterprise IT Strategy, Program Management, and Systems Integration Support  ",
      "description": "Provide enterprise IT strategy, project and program management, systems integration, agile delivery support, organizational change management, and technical training.",
      "status": "Active",
      "posted_at": "2026-08-01",
      "due_at": "2026-09-15T17:00:00-07:00",
      "place_of_performance": "California",
      "procurement_method": "Request for Offer",
      "contract_vehicle": "Synthetic Statewide Contract",
      "estimated_value": {
        "amount": 2500000,
        "currency": "USD"
      },
      "data_freshness_days": 4
    },
    "missing_fields": [],
    "data_freshness_days": 4,
    "limitations": []
  },
  "service_alignment": {
    "alignment_schema_version": "1.0.0",
    "case_id": "CASE-D850D326D21B745D",
    "organization_id": "ICMSOL",
    "profile_version": "1.0.0",
    "service_catalog_version": "1.0.0",
    "matched_capabilities": [
      {
        "capability_id": "ICM-PM-001",
        "capability_name": "Project and Program Management",
        "service_family_id": "SF03",
        "matched_terms": [
          "program management"
        ],
        "match_strength": "strong",
        "evidence_text": "Opportunity text matched configured terms for Project and Program Management: program management"
      },
      {
        "capability_id": "ICM-OCM-005",
        "capability_name": "Technical Training and Knowledge Transfer",
        "service_family_id": "SF06",
        "matched_terms": [
          "technical training"
        ],
        "match_strength": "strong",
        "evidence_text": "Opportunity text matched configured terms for Technical Training and Knowledge Transfer: technical training"
      },
      {
        "capability_id": "ICM-ITS-001",
        "capability_name": "IT Strategic Planning",
        "service_family_id": "SF01",
        "matched_terms": [
          "it strategy"
        ],
        "match_strength": "strong",
        "evidence_text": "Opportunity text matched configured terms for IT Strategic Planning: it strategy"
      },
      {
        "capability_id": "ICM-CDI-005",
        "capability_name": "Systems Integration and API Enablement",
        "service_family_id": "SF02",
        "matched_terms": [
          "systems integration"
        ],
        "match_strength": "strong",
        "evidence_text": "Opportunity text matched configured terms for Systems Integration and API Enablement: systems integration"
      },
      {
        "capability_id": "ICM-PM-006",
        "capability_name": "Waterfall, Agile, Hybrid, and Client-Specific Delivery",
        "service_family_id": "SF03",
        "matched_terms": [
          "agile"
        ],
        "match_strength": "weak",
        "evidence_text": "Opportunity text matched configured terms for Waterfall, Agile, Hybrid, and Client-Specific Delivery: agile"
      }
    ],
    "excluded_matches": [],
    "alignment_score": 1.0,
    "alignment_label": "strong_alignment",
    "staffing_families": [
      "Application and Integration Delivery",
      "Change and Learning",
      "Program Delivery and Oversight",
      "Strategy and Architecture"
    ],
    "reason_codes": [
      "ALIGNMENT_STRONG"
    ],
    "limitations": [
      {
        "code": "SCREENING_NOT_DECISION",
        "description": "Configuration-driven term alignment is a transparent screening input, not a complete scope, capacity, eligibility, award-probability, or final pursuit decision.",
        "material": true,
        "mitigation": "Review the full solicitation, qualifications, current availability, and authoritative evidence before a human decision."
      },
      {
        "code": "TEXT_MATCH_LIMIT",
        "description": "The assessment evaluates configured terms in normalized opportunity text and may miss implied or differently worded scope.",
        "material": true,
        "mitigation": "Use human review and later evidence retrieval to confirm or reject the preliminary service alignment."
      }
    ]
  },
  "historical_context": {
    "context_schema_version": "1.0.0",
    "case_id": "CASE-D850D326D21B745D",
    "source_period": {
      "start_date": "2021-07-01",
      "end_date": "2026-06-30"
    },
    "source_records": 29646,
    "matched_historical_records": 122,
    "service_category_counts": {
      "IT Consulting & Staff Augmentation": 20,
      "Organizational Change, Training & Process": 14,
      "Project Management, IV&V & Quality": 9,
      "Software Development & Systems Integration": 79
    },
    "staffing_family_counts": {
      "Advisory, Assurance & Change": 43,
      "Technology Delivery": 79
    },
    "source_asset_checksums": {
      "analysis_summary.json": "95a3d060abca97638a3aa6da6cc1899bc6ccfa23e62a8c204bdf037d60d226c4",
      "historical_service_context.csv": "94a98461ff71fcfa889e7b0a48f6f7c9a775411eeac9cee902f468e1145534af"
    },
    "interpretation": "The frozen Project 2 dataset contains 29,646 records, including 176 title-classified ICM-relevant records. The current alignment maps to 122 historical records across 4 configured service categories. This is descriptive directional context only and does not predict award likelihood, contract value, labor demand, or current capacity.",
    "limitations": [
      {
        "code": "DESCRIPTIVE_ONLY",
        "description": "Historical counts summarize a frozen 2021-07-01 through 2026-06-30 procurement dataset and are not predictive.",
        "material": true,
        "mitigation": "Use current solicitation evidence and authorized human judgment."
      },
      {
        "code": "TITLE_CLASSIFICATION_LIMIT",
        "description": "The source records were identified using transparent title-based rules and may not reflect complete solicitation scope.",
        "material": true,
        "mitigation": "Treat counts as directional context and review current full-text evidence."
      },
      {
        "code": "NOT_CAPACITY_OR_AWARD_FORECAST",
        "description": "The counts do not measure contract value, labor hours, current staffing capacity, eligibility, or award probability.",
        "material": true,
        "mitigation": "Verify current capacity, qualifications, and pursuit decisions separately."
      }
    ]
  },
  "clause_predictions": [],
  "evidence_items": [],
  "evidence_assessments": [],
  "recommendation": null,
  "human_disposition": null,
  "audit_event_ids": [
    "AUD-CASE-D850D326D21B745D-01",
    "AUD-CASE-D850D326D21B745D-02",
    "AUD-CASE-D850D326D21B745D-03",
    "AUD-CASE-D850D326D21B745D-04",
    "AUD-CASE-D850D326D21B745D-05"
  ],
  "processing_errors": [],
  "production_boundary": "Controlled capstone prototype; nonbinding recommendations only; no autonomous external action; final human authority required."
}
